[
  {
    "ticker": "ADMF",
    "name": "Adira Dinamika Multi Finance Tbk",
    "sector": "FINANCE",
    "description": "Adira Dinamika Multi Finance Tbk tercatat di Bursa Efek Indonesia sektor FINANCE. Informasi resmi tersedia pada factsheet IDX dan Sectors company profile. Sumber: idx.co.id",
    "sourceUrl": "https://www.idx.co.id/en/listed-companies/company-profiles/ADMF"
  },
  {
    "ticker": "AGRO",
    "name": "Bank Raya Indonesia Tbk",
    "sector": "FINANCE",
    "description": "Bank Raya Indonesia Tbk tercatat di Bursa Efek Indonesia sektor FINANCE. Informasi resmi tersedia pada factsheet IDX dan Sectors company profile. Sumber: idx.co.id",
    "sourceUrl": "https://www.idx.co.id/en/listed-companies/company-profiles/AGRO"
  },
  {
    "ticker": "BACA",
    "name": "Bank Capital Indonesia Tbk",
    "sector": "FINANCE",
    "description": "Bank Capital Indonesia Tbk tercatat di Bursa Efek Indonesia sektor FINANCE. Informasi resmi tersedia pada factsheet IDX dan Sectors company profile. Sumber: idx.co.id",
    "sourceUrl": "https://www.idx.co.id/en/listed-companies/company-profiles/BACA"
  },
  {
    "ticker": "BBCA",
    "name": "Bank Central Asia Tbk",
    "sector": "FINANCE",
    "description": "Bank Central Asia Tbk tercatat di Bursa Efek Indonesia sektor FINANCE. Informasi resmi tersedia pada factsheet IDX dan Sectors company profile. Sumber: idx.co.id",
    "sourceUrl": "https://www.idx.co.id/en/listed-companies/company-profiles/BBCA"
  },
  {
    "ticker": "BBNI",
    "name": "Bank Negara Indonesia Tbk",
    "sector": "FINANCE",
    "description": "Bank Negara Indonesia Tbk tercatat di Bursa Efek Indonesia sektor FINANCE. Informasi resmi tersedia pada factsheet IDX dan Sectors company profile. Sumber: idx.co.id",
    "sourceUrl": "https://www.idx.co.id/en/listed-companies/company-profiles/BBNI"
  },
  {
    "ticker": "BBRI",
    "name": "Bank Rakyat Indonesia Tbk",
    "sector": "FINANCE",
    "description": "Bank Rakyat Indonesia Tbk tercatat di Bursa Efek Indonesia sektor FINANCE. Informasi resmi tersedia pada factsheet IDX dan Sectors company profile. Sumber: idx.co.id",
    "sourceUrl": "https://www.idx.co.id/en/listed-companies/company-profiles/BBRI"
  },
  {
    "ticker": "BBTN",
    "name": "Bank Tabungan Negara Tbk",
    "sector": "FINANCE",
    "description": "Bank Tabungan Negara Tbk tercatat di Bursa Efek Indonesia sektor FINANCE. Informasi resmi tersedia pada factsheet IDX dan Sectors company profile. Sumber: idx.co.id",
    "sourceUrl": "https://www.idx.co.id/en/listed-companies/company-profiles/BBTN"
  },
  {
    "ticker": "BDMN",
    "name": "Bank Danamon Indonesia Tbk",
    "sector": "FINANCE",
    "description": "Bank Danamon Indonesia Tbk tercatat di Bursa Efek Indonesia sektor FINANCE. Informasi resmi tersedia pada factsheet IDX dan Sectors company profile. Sumber: idx.co.id",
    "sourceUrl": "https://www.idx.co.id/en/listed-companies/company-profiles/BDMN"
  },
  {
    "ticker": "BEKS",
    "name": "Bank Pembangunan Daerah Banten Tbk",
    "sector": "FINANCE",
    "description": "Bank Pembangunan Daerah Banten Tbk tercatat di Bursa Efek Indonesia sektor FINANCE. Informasi resmi tersedia pada factsheet IDX dan Sectors company profile. Sumber: idx.co.id",
    "sourceUrl": "https://www.idx.co.id/en/listed-companies/company-profiles/BEKS"
  },
  {
    "ticker": "BFIN",
    "name": "BFI Finance Indonesia Tbk",
    "sector": "FINANCE",
    "description": "BFI Finance Indonesia Tbk tercatat di Bursa Efek Indonesia sektor FINANCE. Informasi resmi tersedia pada factsheet IDX dan Sectors company profile. Sumber: idx.co.id",
    "sourceUrl": "https://www.idx.co.id/en/listed-companies/company-profiles/BFIN"
  },
  {
    "ticker": "BGTG",
    "name": "Bank Ganesha Tbk",
    "sector": "FINANCE",
    "description": "Bank Ganesha Tbk tercatat di Bursa Efek Indonesia sektor FINANCE. Informasi resmi tersedia pada factsheet IDX dan Sectors company profile. Sumber: idx.co.id",
    "sourceUrl": "https://www.idx.co.id/en/listed-companies/company-profiles/BGTG"
  },
  {
    "ticker": "BJBR",
    "name": "Bank Jabar Banten Tbk",
    "sector": "FINANCE",
    "description": "Bank Jabar Banten Tbk tercatat di Bursa Efek Indonesia sektor FINANCE. Informasi resmi tersedia pada factsheet IDX dan Sectors company profile. Sumber: idx.co.id",
    "sourceUrl": "https://www.idx.co.id/en/listed-companies/company-profiles/BJBR"
  },
  {
    "ticker": "BJTM",
    "name": "Bank Jawa Timur Tbk",
    "sector": "FINANCE",
    "description": "Bank Jawa Timur Tbk tercatat di Bursa Efek Indonesia sektor FINANCE. Informasi resmi tersedia pada factsheet IDX dan Sectors company profile. Sumber: idx.co.id",
    "sourceUrl": "https://www.idx.co.id/en/listed-companies/company-profiles/BJTM"
  },
  {
    "ticker": "BMRG",
    "name": "Bank Rakyat (BMRG) Tbk",
    "sector": "FINANCE",
    "description": "Bank Rakyat (BMRG) Tbk tercatat di Bursa Efek Indonesia sektor FINANCE. Informasi resmi tersedia pada factsheet IDX dan Sectors company profile. Sumber: idx.co.id",
    "sourceUrl": "https://www.idx.co.id/en/listed-companies/company-profiles/BMRG"
  },
  {
    "ticker": "BMRI",
    "name": "Bank Mandiri Tbk",
    "sector": "FINANCE",
    "description": "Bank Mandiri Tbk tercatat di Bursa Efek Indonesia sektor FINANCE. Informasi resmi tersedia pada factsheet IDX dan Sectors company profile. Sumber: idx.co.id",
    "sourceUrl": "https://www.idx.co.id/en/listed-companies/company-profiles/BMRI"
  },
  {
    "ticker": "BNGA",
    "name": "Bank CIMB Niaga Tbk",
    "sector": "FINANCE",
    "description": "Bank CIMB Niaga Tbk tercatat di Bursa Efek Indonesia sektor FINANCE. Informasi resmi tersedia pada factsheet IDX dan Sectors company profile. Sumber: idx.co.id",
    "sourceUrl": "https://www.idx.co.id/en/listed-companies/company-profiles/BNGA"
  },
  {
    "ticker": "BNLI",
    "name": "Bank Permata Tbk",
    "sector": "FINANCE",
    "description": "Bank Permata Tbk tercatat di Bursa Efek Indonesia sektor FINANCE. Informasi resmi tersedia pada factsheet IDX dan Sectors company profile. Sumber: idx.co.id",
    "sourceUrl": "https://www.idx.co.id/en/listed-companies/company-profiles/BNLI"
  },
  {
    "ticker": "BRIS",
    "name": "Bank Syariah Indonesia Tbk",
    "sector": "FINANCE",
    "description": "Bank Syariah Indonesia Tbk tercatat di Bursa Efek Indonesia sektor FINANCE. Informasi resmi tersedia pada factsheet IDX dan Sectors company profile. Sumber: idx.co.id",
    "sourceUrl": "https://www.idx.co.id/en/listed-companies/company-profiles/BRIS"
  },
  {
    "ticker": "BSIM",
    "name": "Bank Sinarmas Tbk",
    "sector": "FINANCE",
    "description": "Bank Sinarmas Tbk tercatat di Bursa Efek Indonesia sektor FINANCE. Informasi resmi tersedia pada factsheet IDX dan Sectors company profile. Sumber: idx.co.id",
    "sourceUrl": "https://www.idx.co.id/en/listed-companies/company-profiles/BSIM"
  },
  {
    "ticker": "MAYA",
    "name": "Bank Mayapada Internasional Tbk",
    "sector": "FINANCE",
    "description": "Bank Mayapada Internasional Tbk tercatat di Bursa Efek Indonesia sektor FINANCE. Informasi resmi tersedia pada factsheet IDX dan Sectors company profile. Sumber: idx.co.id",
    "sourceUrl": "https://www.idx.co.id/en/listed-companies/company-profiles/MAYA"
  },
  {
    "ticker": "MFIN",
    "name": "Mandala Multifinance Tbk",
    "sector": "FINANCE",
    "description": "Mandala Multifinance Tbk tercatat di Bursa Efek Indonesia sektor FINANCE. Informasi resmi tersedia pada factsheet IDX dan Sectors company profile. Sumber: idx.co.id",
    "sourceUrl": "https://www.idx.co.id/en/listed-companies/company-profiles/MFIN"
  },
  {
    "ticker": "NISP",
    "name": "Bank OCBC NISP Tbk",
    "sector": "FINANCE",
    "description": "Bank OCBC NISP Tbk tercatat di Bursa Efek Indonesia sektor FINANCE. Informasi resmi tersedia pada factsheet IDX dan Sectors company profile. Sumber: idx.co.id",
    "sourceUrl": "https://www.idx.co.id/en/listed-companies/company-profiles/NISP"
  },
  {
    "ticker": "PNBN",
    "name": "Bank Pan Indonesia Tbk",
    "sector": "FINANCE",
    "description": "Bank Pan Indonesia Tbk tercatat di Bursa Efek Indonesia sektor FINANCE. Informasi resmi tersedia pada factsheet IDX dan Sectors company profile. Sumber: idx.co.id",
    "sourceUrl": "https://www.idx.co.id/en/listed-companies/company-profiles/PNBN"
  },
  {
    "ticker": "SDRA",
    "name": "Bank Woori Saudara Indonesia 1906 Tbk",
    "sector": "FINANCE",
    "description": "Bank Woori Saudara Indonesia 1906 Tbk tercatat di Bursa Efek Indonesia sektor FINANCE. Informasi resmi tersedia pada factsheet IDX dan Sectors company profile. Sumber: idx.co.id",
    "sourceUrl": "https://www.idx.co.id/en/listed-companies/company-profiles/SDRA"
  },
  {
    "ticker": "TRUS",
    "name": "Trust Finance Indonesia Tbk",
    "sector": "FINANCE",
    "description": "Trust Finance Indonesia Tbk tercatat di Bursa Efek Indonesia sektor FINANCE. Informasi resmi tersedia pada factsheet IDX dan Sectors company profile. Sumber: idx.co.id",
    "sourceUrl": "https://www.idx.co.id/en/listed-companies/company-profiles/TRUS"
  },
  {
    "ticker": "ACES",
    "name": "Ace Hardware Indonesia Tbk",
    "sector": "OTHER",
    "description": "Ace Hardware Indonesia Tbk tercatat di Bursa Efek Indonesia sektor OTHER. Informasi resmi tersedia pada factsheet IDX dan Sectors company profile. Sumber: idx.co.id",
    "sourceUrl": "https://www.idx.co.id/en/listed-companies/company-profiles/ACES"
  },
  {
    "ticker": "ADES",
    "name": "Akasha Wira International Tbk",
    "sector": "CONSUMER",
    "description": "Akasha Wira International Tbk tercatat di Bursa Efek Indonesia sektor CONSUMER. Informasi resmi tersedia pada factsheet IDX dan Sectors company profile. Sumber: idx.co.id",
    "sourceUrl": "https://www.idx.co.id/en/listed-companies/company-profiles/ADES"
  },
  {
    "ticker": "ADHI",
    "name": "Adhi Karya Tbk",
    "sector": "INFRA",